UDS 속성명,SSG 필드명,API 카테고리,사용 API 문서 수,공통/반복,UDS 필요도,설명
(변경)출고예정일(=입고예정일자와 동일) * short,whinExpcDt,업체 주문/배송,1,단일,✅ 핵심 UDS,"whinExpcDt: (변경)출고예정일(=입고예정일자와 동일) * shortgRsnCd: 21일 때 당일 날짜만 등록 가능 * shortgRsnCd: 01, 02, 03일 때 익일날짜부터 등록 가능 (Changed)Warehouse Out Expected Date(=Same as Warehouse In Expected Date) * If shortgRsnCd is 21, only the date can be registered. * If shortgRsnCd is 01, 02 or 03, You can register from the next day."
(변경)출고예정일자(=입고예정일자와 동일) (Chang,whinExpcDt,업체 주문/배송,1,단일,✅ 핵심 UDS,whinExpcDt: (변경)출고예정일자(=입고예정일자와 동일) (Changed)Warehouse Out Expected Date(=Same as Warehouse In Expected Date)
API 인증키,Authorization,업체 주문/배송,1,단일,✅ 핵심 UDS,Authorization: 업체 인증키 Vendor API Authentication Key | Authorization: 샘플코드에서 확인된 필드 | Authorization: 샘플코드에서 확인된 필드
Integer,whinDelayNts / whoutDelayNts,업체 주문/배송,1,단일,✅ 핵심 UDS,whinDelayNts: Integer | whoutDelayNts: Integer
deliveryEnd,deliveryEnd,업체 주문/배송,1,단일,✅ 핵심 UDS,
deliveryEnds,deliveryEnds,업체 주문/배송,1,단일,✅ 핵심 UDS,
nonDelivery,nonDelivery,업체 주문/배송,1,단일,✅ 핵심 UDS,
nonDeliverys,nonDeliverys,업체 주문/배송,1,단일,✅ 핵심 UDS,
requestDeliveryEnd,requestDeliveryEnd,업체 주문/배송,1,단일,✅ 핵심 UDS,
requestNoSellRequestRegist,requestNoSellRequestRegist,업체 주문/배송,1,단일,✅ 핵심 UDS,
requestNonDelivery,requestNonDelivery,업체 주문/배송,1,단일,✅ 핵심 UDS,
requestOrderSubjectManage,requestOrderSubjectManage,업체 주문/배송,1,단일,✅ 핵심 UDS,
requestShppDirection,requestShppDirection,업체 주문/배송,1,단일,✅ 핵심 UDS,
requestShppingDelay,requestShppingDelay,업체 주문/배송,1,단일,✅ 핵심 UDS,
requestWarehouseOut,requestWarehouseOut,업체 주문/배송,1,단일,✅ 핵심 UDS,
requestWhOutCompleteProcess,requestWhOutCompleteProcess,업체 주문/배송,1,단일,✅ 핵심 UDS,
shppDirection,shppDirection,업체 주문/배송,1,단일,✅ 핵심 UDS,
shppDirections,shppDirections,업체 주문/배송,1,단일,✅ 핵심 UDS,
warehouseOut,warehouseOut,업체 주문/배송,1,단일,✅ 핵심 UDS,
warehouseOuts,warehouseOuts,업체 주문/배송,1,단일,✅ 핵심 UDS,
개런티 주문여부 Y/N GuaranteeItem Ord,ordItemCertNoYn,업체 주문/배송,1,단일,✅ 핵심 UDS,ordItemCertNoYn: 개런티 주문여부 Y/N GuaranteeItem OrderType Yes Or No Y/N | ordItemCertNoYn: 개런티 주문여부 Y/N GuaranteeItem OrderType Yes Or No Y/N | ordItemCertNoYn: 개런티 주문여부 Y/N GuaranteeItem OrderType Yes Or No Y/N
개인통관고유부호,pCus,업체 주문/배송,1,단일,✅ 핵심 UDS,pCus: 개인통관고유번호 Personal Serial Number For Customs | pCus: 개인통관고유번호 Personal Serial Number For Customs | pCus: 개인통관고유번호 Personal Serial Number For Customs
결과,result,업체 주문/배송,1,단일,✅ 핵심 UDS,result: 샘플코드에서 확인된 필드 | result: 샘플코드에서 확인된 필드 | result: 샘플코드에서 확인된 필드
결과 메시지,resultMessage,업체 주문/배송,1,단일,✅ 핵심 UDS,resultMessage: 결과 값 Result Message | resultMessage: 샘플코드에서 확인된 필드 | resultMessage: 결과 값 Result Message
결과 설명,resultDesc,업체 주문/배송,1,단일,✅ 핵심 UDS,resultDesc: 오류 메시지 Error Message | resultDesc: 샘플코드에서 확인된 필드 | resultDesc: 오류 메시지 Error Message
결과코드,resultCode,업체 주문/배송,1,단일,✅ 핵심 UDS,resultCode: 결과 코드 Result Code | resultCode: 샘플코드에서 확인된 필드 | resultCode: 결과 코드 Result Code
결제완료일시 Payment Completed Date,paymtDt,업체 주문/배송,1,단일,✅ 핵심 UDS,paymtDt: 결제완료일시 Payment Completed Date
결품진행상태명 Shortage Of Stock Progress Statu,shortgProgStatNm,업체 주문/배송,1,단일,✅ 핵심 UDS,shortgProgStatNm: 결품진행상태명 Shortage Of Stock Progress Status Name
공급가,splprc,업체 주문/배송,1,단일,✅ 핵심 UDS,splprc: 공급가 Supply Price | splprc: 샘플코드에서 확인된 필드 | splprc: 공급가 Supplier
공급가 Supply Price,splPrc,업체 주문/배송,1,단일,✅ 핵심 UDS,splPrc: 공급가 Supply Price
공급업체명 Supply Vendor Name,shppVenNm,업체 주문/배송,1,단일,✅ 핵심 UDS,shppVenNm: 공급업체명 Supply Vendor Name | shppVenNm: 공급업체명 Supply Vendor Name
공급업체아이디 Supply Vendor Identifi,shppVenId,업체 주문/배송,1,단일,✅ 핵심 UDS,shppVenId: 공급업체아이디 Supply Vendor Identification | shppVenId: 공급업체아이디 Supply Vendor Identification
국내/외 구분 Y/N Domestic Or Intern,frgShppYn,업체 주문/배송,1,단일,✅ 핵심 UDS,frgShppYn: 국내/외 구분 Y/N Domestic Or International Yes Or No Domestic : N International : Y | frgShppYn: 국내/외 구분 Y/N Domestic Or International Yes Or No Domestic : N International : Y
국내/외 구분 국내 : N 국외 : Y Domestic,frgShppYn,업체 주문/배송,1,단일,✅ 핵심 UDS,frgShppYn: 국내/외 구분 국내 : N 국외 : Y Domestic Or International Yes Or No Domestic : N International : Y | frgShppYn: 국내/외 구분 국내 : N 국외 : Y Domestic Or International Yes Or No Domestic : N International : Y | frgShppYn: 국내/외 구분 국내 : N 국외 : Y Domestic Or International Yes Or No Domestic : N International : Y
기출하 주문여부 Orders already shipped,preShpmt,업체 주문/배송,1,단일,✅ 핵심 UDS,preShpmt: 기출하 주문여부 Orders already shipped
단품 ID,uitemId,업체 주문/배송,1,단일,✅ 핵심 UDS,uitemId: 단품ID Unit Item Identification | uitemId: 샘플코드에서 확인된 필드 | uitemId: 단품ID Unit Item Identification
단품명,uitemNm,업체 주문/배송,1,단일,✅ 핵심 UDS,uitemNm: 단품명 Unit Item Name | uitemNm: 샘플코드에서 확인된 필드 | uitemNm: 단품명 Unit Item Name
등록/삭제구분 08 상품정보오류 09 결품 Regist,shortgRsnCd,업체 주문/배송,1,단일,✅ 핵심 UDS,shortgRsnCd: 등록/삭제구분 08 상품정보오류 09 결품 Regist/Remove Code 08 Product Information Error 09 Out of Stock
등록/삭제구분 I 등록 D 삭제 Regist/Remove Code I R,scEvnt,업체 주문/배송,1,단일,✅ 핵심 UDS,scEvnt: 등록/삭제구분 I 등록 D 삭제 Regist/Remove Code I Regist D Remove
"등록삭제구분 I:등록, D:삭제 regist/remov",cudCd,업체 주문/배송,1,단일,✅ 핵심 UDS,"cudCd: 등록삭제구분 I:등록, D:삭제 regist/remove Code I:regist, D:remove"
모델명 Model Name,mdlNm,업체 주문/배송,1,단일,✅ 핵심 UDS,mdlNm: 모델명 Model Name | mdlNm: 모델명 Model Name | mdlNm: 모델명 Model Name
몰 유형코드,mallTypeCd,업체 주문/배송,1,단일,✅ 핵심 UDS,mallTypeCd: 몰유형코드 10: 종합몰 20: 오픈마켓 Mall Type 10: general mall 20: open market | mallTypeCd: 몰유형코드 10: 종합몰 20: 오픈마켓 Mall Type 10: general mall 20: open market | mallTypeCd: 몰유형코드 10: 종합몰 20: 오픈마켓 Mall Type 10: general mall 20: open market
몰구분 6001 이마트몰 6002 트레이더스몰 6003,infloSiteNo,업체 주문/배송,1,단일,✅ 핵심 UDS,infloSiteNo: 몰구분 6001 이마트몰 6002 트레이더스몰 6003 분스몰 6004 신세계몰 6005 S.COM몰 6009 신세계백화점몰 Mall Division 6001 Emart Mall 6002 Traders Mall 6003 BOONS Mall 6004 Shinsegae Mall 6005 S.COM Mall 6009 Shinsegae Department Store Mall | infloSiteNo: 몰구분 6001 이마트몰 6002 트레이더스몰 6003 분스몰 6004 신세계몰 6005 S.COM몰 6009 신세계백화점몰 Mall Division 6001 Emart Mall 6002 Traders Mall 6003 BOONS Mall 6004 Shinsegae Mall 6005 S.COM Mall 6009 Shinsegae Department Store Mall
박스번호 Box Number,boxNo,업체 주문/배송,1,단일,✅ 핵심 UDS,boxNo: 박스번호 Box Number
배송구분상세명 Release Type Name,shppDivDtlNm,업체 주문/배송,1,단일,✅ 핵심 UDS,shppDivDtlNm: 배송구분상세명 Release Type Name | shppDivDtlNm: 배송구분상세명 Release Type Name | shppDivDtlNm: 배송구분상세명 Release Type Name
배송번호,shppNo,업체 주문/배송,1,단일,✅ 핵심 UDS,shppNo: 배송번호 Shipping Number | shppNo: 샘플코드에서 확인된 필드 | shppNo: 배송번호 Shipping Number
배송비,shppcst,업체 주문/배송,1,단일,✅ 핵심 UDS,shppcst: 배송비 Shipping Cost | shppcst: 샘플코드에서 확인된 필드 | shppcst: 배송비 Shipping Cost
배송비 정책 ID,shppcstId,업체 주문/배송,1,단일,✅ 핵심 UDS,shppcstId: 배송비정책아이디 Shipping Cost Policy Identification
배송사 메모,memoCntt,업체 주문/배송,1,단일,✅ 핵심 UDS,"memoCntt: 배송업무메모 Shipping Company Memo | memoCntt: 배송업무메모 * shortgRsnCd: 02 일때만 필수 Shipping Task Memo * If shortgRsnCd is 02, then mandatory value | memoCntt: 샘플코드에서 확인된 필드"
배송상태 코드,shppStatCd,업체 주문/배송,1,단일,✅ 핵심 UDS,shppStatCd: 배송상태코드 10 정상 30 대기 Shipping Status Code 10 Normal 30 On Hold | shppStatCd: 배송상태코드 10 정상 30 대기 Shipping Status Code 10 Normal 30 On Hold | shppStatCd: 배송상태코드 10 정상 30 대기 Shipping Status Code 10 Normal 30 On Hold
배송상태명 Shipping Status Name,shppStatNm,업체 주문/배송,1,단일,✅ 핵심 UDS,shppStatNm: 배송상태명 Shipping Status Name | shppStatNm: 배송상태명 Shipping Status Name
배송상품 구분코드,shppItemDivCd,업체 주문/배송,1,단일,✅ 핵심 UDS,shppItemDivCd: 배송상품구분코드 01 : 일반 02 : 해외구매대행 03 : 설치(유료) 04 : 설치(무료) 05 : 주문제작 06 : 해외직배송 Shipping Item Type 01 : Normal 02 : Overseas Purchasing 03 : Paid Installation 04 : Free Installation 05 : Custom Made Products 06 : International Shipping | shppItemDivCd: 샘플코드에서 확인된 필드 | shppItemDivCd: 배송상품구분코드 01 : 일반 02 : 해외구매대행 03 : 설치(유료) 04 : 설치(무료) 05 : 주문제작 06 : 해외직배송 Shipping Item Type 01 : Normal 02 : Overseas Purchasing 03 : Paid Installation 04 : Free Installation 05 : Custom Made Products 06 : International Shipping
배송순번,shppSeq,업체 주문/배송,1,단일,✅ 핵심 UDS,shppSeq: 배송순번 Shipping Sequence | shppSeq: 샘플코드에서 확인된 필드 | shppSeq: 배송순번 Shipping Item Sequence
배송예약 유형코드,shppRsvtTypeCd,업체 주문/배송,1,단일,✅ 핵심 UDS,shppRsvtTypeCd: 배송예약유형코드 30 일반상품희망발송일자 32 오늘출발상품배송일자 40 예약상품배송일자 Release Type 30 Requested Ship Date 32 Same-Day Ship Delivery Date 40 Scheduled Delivery Date | shppRsvtTypeCd: 배송예약유형코드 30 일반상품희망발송일자 32 오늘출발상품배송일자 40 예약상품배송일자 Release Type 30 Requested Ship Date 32 Same-Day Ship Delivery Date 40 Scheduled Delivery Date | shppRsvtTypeCd: 샘플코드에서 확인된 필드
배송예약유형명 Release Type Name,shppRsvtTypeNm,업체 주문/배송,1,단일,✅ 핵심 UDS,shppRsvtTypeNm: 배송예약유형명 Release Type Name | shppRsvtTypeNm: 배송예약유형명 Release Type Name
배송예약일,shppRsvtDt,업체 주문/배송,1,단일,✅ 핵심 UDS,shppRsvtDt: 출고예정일자 Release Scheduled Date | shppRsvtDt: 샘플코드에서 확인된 필드 | shppRsvtDt: 출고예정일자 Release Scheduled Date
배송예외구분코드 10 : 부분출고 60 : 예외없음 7,shppExptDivCd,업체 주문/배송,1,단일,✅ 핵심 UDS,shppExptDivCd: 배송예외구분코드 10 : 부분출고 60 : 예외없음 70 : 결품재지시 Shipping exception classification code 10 : Partial Release 60 : No exceptions 70 : Shortage Reinstruct | shppExptDivCd: 배송예외구분코드 10 : 부분출고 60 : 예외없음 70 : 결품재지시 Shipping exception classification code 10 : Partial Release 60 : No exceptions 70 : Shortage Reinstruct
배송완료일시 Shipping Completed Date,shppDt,업체 주문/배송,1,단일,✅ 핵심 UDS,shppDt: 배송완료일시 Shipping Completed Date
배송유형 상세코드,shppTypeDtlCd,업체 주문/배송,1,단일,✅ 핵심 UDS,shppTypeDtlCd: 배송유형상세코드 14 업체자사배송 22 업체택배배송 25 해외택배배송 31 매장방문 41 등기 51 SMS 52 EMAIL 61 미발송 91 업체프리미엄 Shipping Type Detail 14 Vendor's In-House Shipping 22 Vendor Shipping 25 International Shipping 31 In-Store Visit 41 Mail 51 SMS 52 EMAIL 61 Not Shipped 91 Premium Shipping | shppTypeDtlCd: 샘플코드에서 확인된 필드 | shppTypeDtlCd: 배송유형상세코드 14 업체자사배송 22 업체택배배송 25 해외택배배송 31 매장방문 41 등기 51 SMS 52 EMAIL 61 미발송 91 업체프리미엄배송 Shipping Type Detail 14 Vendor's In-House Shipping 22 Vendor Shipping 25 International Shipping 31 In-Store Visit 41 Mail 51 SMS 52 EMAIL 61 Not Shipped 91 Premium Shipping
배송유형 코드,shppTypeCd,업체 주문/배송,1,단일,✅ 핵심 UDS,shppTypeCd: 배송유형코드 10 자사배송 20 택배배송 30 매장방문 40 등기 50 미배송 60 미발송 90 특수배송 Shipping Type Code 10 In-House Shipping 20 Vendor Shipping 30 In-Store Visit 40 Mail 50 Not Shipped 60 Not Sent 90 Special Shipping | shppTypeCd: 샘플코드에서 확인된 필드 | shppTypeCd: 배송유형코드 10 자사배송 20 택배배송 30 매장방문 40 등기 50 미배송 60 미발송 90 특수배송 Shipping Type Code 10 In-House Shipping 20 Vendor Shipping 30 In-Store Visit 40 Mail 50 Not Shipped 60 Not Sent 90 Special Shipping
배송유형명 Shipping Type Name,shppTypeNm,업체 주문/배송,1,단일,✅ 핵심 UDS,shppTypeNm: 배송유형명 Shipping Type Name | shppTypeNm: 배송유형명 Shipping Type Name
배송유형상세명 Shipping Type Detail Name,shppTypeDtlNm,업체 주문/배송,1,단일,✅ 핵심 UDS,shppTypeDtlNm: 배송유형상세명 Shipping Type Detail Name | shppTypeDtlNm: 배송유형상세명 Shipping Type Detail Name
배송주체코드 32 업체창고 41 협력업체 42 브랜드직,shppMainCd,업체 주문/배송,1,단일,✅ 핵심 UDS,shppMainCd: 배송주체코드 32 업체창고 41 협력업체 42 브랜드직배 Shipping Main Code 32 Vendor's Warehouse 41 Cooperative Company 42 Brand Direct Shipping
배송지 기본주소,shpplocBascAddr,업체 주문/배송,1,단일,✅ 핵심 UDS,"shpplocBascAddr: 수취인 행정구역 + 도로명 + 건물번호 (도로명 주소가 없는 경우 지번 기본 주소) Recipient Administrative District + Street Name + Building Number (If there is no road name address, the land lot number basic address is returned.) | shpplocBascAddr: 수취인 행정구역 + 도로명 + 건물번호 (도로명 주소가 없는 경우 지번 기본 주소) Recipient Administrative District + Street Name + Building Number (If there is no road name address, the land lot number basic address is returned.)"
배송지 상세주소,shpplocDtlAddr,업체 주문/배송,1,단일,✅ 핵심 UDS,"shpplocDtlAddr: 수취인 도로명 상세주소 (도로명 주소가 없는 경우 지번 상세 주소) Recipient Road Name Detail Address (If there is no road name address, the land lot number detail address is returned.) | shpplocDtlAddr: 수취인 도로명 상세주소 (도로명 주소가 없는 경우 지번 상세 주소) Recipient Road Name Detail Address (If there is no road name address, the land lot number detail address is returned.)"
배송지 우편번호,shpplocZipcd,업체 주문/배송,1,단일,✅ 핵심 UDS,shpplocZipcd: 수취인 우편번호 Recipient Postal Code | shpplocZipcd: 샘플코드에서 확인된 필드 | shpplocZipcd: 수취인 우편번호 Recipient Postal Code
배송지 지번주소,shpplocAddr,업체 주문/배송,1,단일,✅ 핵심 UDS,shpplocAddr: 수취인 지번주소 Recipient Land Lot Number Address | shpplocAddr: 샘플코드에서 확인된 필드 | shpplocAddr: 수취인 지번주소 Recipient Land Lot Number Address
배송진행상태 상세코드,shppProgStatDtlCd,업체 주문/배송,1,단일,✅ 핵심 UDS,shppProgStatDtlCd: 상세배송상태 11 배송지시 21 피킹지시 22 피킹완료 31 패킹완료 41 출고대기 42 출고보류 43 출고완료 51 배송완료 52 배송거절 Detail Shipping Process Status 11 Shipping Instructed 21 Picking Instructed 22 Picking Completed 31 Packing Completed 41 Release On Hold 42 Release Delayed 43 Release Completed 51 Shipping Completed 52 Shipping Rejected | shppProgStatDtlCd: 샘플코드에서 확인된 필드
복수 운송장번호,multiWblNo,업체 주문/배송,1,단일,✅ 핵심 UDS,multiWblNo: 복수운송장번호 MultiWaybill Number | multiWblNo: 샘플코드에서 확인된 필드 | multiWblNo: 샘플코드에서 확인된 필드
"빠른조회값, 빠른조회일 경우 필수 값 If quick search, th",commValue,업체 주문/배송,1,단일,✅ 핵심 UDS,"commValue: 빠른조회값, 빠른조회일 경우 필수 값 If quick search, then mandatory value. | commValue: 빠른조회값, 빠른조회일 경우 필수 값 If quick search, then mandatory value. | commValue: 빠른조회값, 빠른조회일 경우 필수 값 If quick search, then mandatory value."
"빠른조회타입, 빠른조회일 경우 필수 값 01 원주문번호 02 배송번호 I",commType,업체 주문/배송,1,단일,✅ 핵심 UDS,"commType: 빠른조회타입, 빠른조회일 경우 필수 값 01 원주문번호 02 배송번호 If general search, then mandatory value. 01 Original Order Number 02 Shipping Number"" | commType: 빠른조회타입, 빠른조회일 경우 필수 값 01 원주문번호 02 배송번호 If general search, then mandatory value. 01 Original Order Number 02 Shipping Number | commType: 빠른조회타입, 빠른조회일 경우 필수 값 01 원주문번호 02 배송번호 If general search, then mandatory value. 01 Original Order Number 02 Shipping Number"
사은품 Free Gift,frebieNm,업체 주문/배송,1,단일,✅ 핵심 UDS,frebieNm: 사은품 Free Gift | frebieNm: 사은품 Free Gift
사이트 번호,siteNo,업체 주문/배송,1,단일,✅ 핵심 UDS,"siteNo: 사이트번호 6001 이마트몰 6002 트레이더스 6003 분스몰 (삭제) 6004 신세계몰 6005 SSG.COM 6009 신세계백화점 6100 howdy 6200 신세계TV쇼핑 6300 S.I.VILLAGE 7009 새벽배송 7008 프리미엄아울렛 7011 까사미아 7012 CHICOR 7013 tr,iip 7014 오픈마켓 7015 스타벅스 7016 eShop 7019 SSG랜더스 Site Number 6001 emart Mall 6002 TRADERS 6003 BOONS Mall (Deleted) 6004 Shinsegae Mall 6005 SSG.COM 6009 Department Store 6100 howdy 6200 TV Shopping 6300 S.I.VILLAGE 7009 dawn delivery 7008 PREMIUM OUTLETS 7011 casamia 7012 CHICOR 7013 tr,iip 7014 OpenMarket 7015 Starbucks 7016 eSh | siteNo: 샘플코드에서 확인된 필드 | siteNo: 사이트번호 6001 이마트몰 6002 트레이더스 6003 분스몰 (삭제) 6004 신세계몰 6005 SSG.COM 6009 신세계백화점 6100 howdy 6200 신세계TV쇼핑 6300 S.I.VILLAGE 7009 새벽배송 7008 프리미엄아울렛 7011 까사미아 7012 CHICOR 7013 tr,iip 7014 오픈마켓 7015 스타벅스 7016 eShop 7019 SSG랜더스 Site Number 6001 emart Mall 6002 TRADERS 6003 BOONS Mall (Deleted) 6004 Shinsegae Mall 6005 SSG.COM 6009 Department Store 6100 howdy 6200 TV Shopping 6300 S.I.VILLAGE 7009 dawn delivery 7008 PREMIUM OUTLETS 7011 casamia 7012 CHICOR 7013 tr,iip 7014 OpenMarket 7015 Starbucks 7016 eSh"
사이트명 Site Name,siteNm,업체 주문/배송,1,단일,✅ 핵심 UDS,siteNm: 사이트명 Site Name | siteNm: 사이트명 Site Name
상세배송진행상태 22 피킹완료 42 출고보류 Detail Shipping,shppProgStatDtl,업체 주문/배송,1,단일,✅ 핵심 UDS,shppProgStatDtl: 상세배송진행상태 22 피킹완료 42 출고보류 Detail Shipping Process Status 22 Picking Completed 42 Release On Hold
상품 ID,itemId,업체 주문/배송,1,단일,✅ 핵심 UDS,itemId: 상품번호 Item Number | itemId: 상품번호 Item Number | itemId: 샘플코드에서 확인된 필드
상품 구분,itemDiv,업체 주문/배송,1,단일,✅ 핵심 UDS,itemDiv: 주문상품구분코드 10 일반 20 명절 GIFT 일반 30 명절 GIFT 센터 40 명절 GIFT 냉장 Order Item Division Code 10:General 20: Holiday GIFT General 30: Holiday GIFT Center 40: Holiday GIFT Refrigerate | itemDiv: 주문상품구분코드 10:일반 20: 명절 GIFT 일반 30: 명절 GIFT 센터 40: 명절 GIFT 냉장 Order Item Division Code 10:General 20: Holiday GIFT General 30: Holiday GIFT Center 40: Holiday GIFT Refrigerate | itemDiv: 샘플코드에서 확인된 필드
상품명,itemNm,업체 주문/배송,1,단일,✅ 핵심 UDS,itemNm: 상품명 Item Name | itemNm: 상품명 Item Name | itemNm: 샘플코드에서 확인된 필드
상품특성구분코드 10 일반 20 몰인몰 30 해외구매대,itemChrctDivCd,업체 주문/배송,1,단일,✅ 핵심 UDS,itemChrctDivCd: 상품특성구분코드 10 일반 20 몰인몰 30 해외구매대행상품 40 미가공귀금속 50 모바일기프트 60 상품권 70 쇼핑충전금 80 모바일상품권 91 이벤트 Item Characteristics Division Code 10 General 20 Mall In Mall 30 International Proxy Purchase 40 Raw Jewelry 50 Mobile Gift 60 Gift Certificate 70 Chargable Shopping Cash 80 Mobile Gift Certificate 91 Event
샘플코드에서 확인된 필드,accept / allnOrdNo / allnTypeNm / autoShortgYn / boxNo / cnclItemQty / commType / commValue / cudCd / delayNts / delicoVenNm / deliveryEnd / deliveryEnds / dircItemQty / evntSeq / frgShppYn / frgShpplocBascAddr / frgShpplocCntryCd / frgShpplocDtlAddr / frgShpplocHpno / frgShpplocTelno / frgShpplocZipcd / instlDscnDt / instlDt / instlExpcDt / itemChrctDivCd / lastShppProgStatDtlCd / lastShppProgStatDtlNm / mdlNm / newRow / newWblNoData / nonDelivery / nonDeliverys / ordCmplDts / ordCnfDts / ordCst / ordCstId / ordCstOccCd / ordItemCertNoYn / ordItemDivNm / ordProcDemndStatCd / ordShpplocId / ordTypeCd06Yn / paymtDt / preShpmt / procItemQty / reOrderYn / requestDeliveryEnd / requestNoSellRequestRegist / requestNonDelivery / requestOrderSubjectManage / requestShppDirection / requestShppingDelay / requestWarehouseOut / requestWhOutCompleteProcess / rsvtItemYn / salestrNo / scEvnt / settlRfltDts / shortgProcDtlc / shortgRsnCd / shortgYn / shppDirection / shppDirections / shppDivDtlNm / shppDt / shppInstlDcsnDt / shppInstlExpcDt / shppLrnkVenId / shppLrnkVenNm / shppMainCd / shppRsvtTypeNm / shppStatNm / shppTabProgStatCd / shppTypeDtlNm / shppTypeNm / shppVenId / shppVenNm / shpplocOldZipcd / shpplocRoadAddr / siteNm / splPrc / warehouseOut / warehouseOuts / wblChngYn / whddDivCd / whddDivCd1 / whinDelayNts / whinExpcDt / whoutCmplDts / whoutCritnDt / whoutDelayNts / whoutDt / whoutItemQty,업체 주문/배송,1,단일,✅ 핵심 UDS,accept: 샘플코드에서 확인된 필드 | requestShppDirection: 샘플코드에서 확인된 필드 | accept: 샘플코드에서 확인된 필드
선물하기 주문여부 Y/N GiftItem OrderTy,ordTypeCd06Yn,업체 주문/배송,1,단일,✅ 핵심 UDS,ordTypeCd06Yn: 선물하기 주문여부 Y/N GiftItem OrderType Yes Or No Y/N | ordTypeCd06Yn: 선물하기 주문여부 Y/N GiftItem OrderType Yes Or No Y/N | ordTypeCd06Yn: 선물하기 주문여부 Y/N GiftItem OrderType Yes Or No Y/N
수령자 전화번호,rcptpeTelno,업체 주문/배송,1,단일,✅ 핵심 UDS,rcptpeTelno: 수취인 집전화번호 Recipient Phone Number | rcptpeTelno: 샘플코드에서 확인된 필드 | rcptpeTelno: 수취인 집전화번호 Recipient Phone Number
수령자 휴대전화,rcptpeHpno,업체 주문/배송,1,단일,✅ 핵심 UDS,rcptpeHpno: 수취인 휴대폰번호 Recipient Mobile Phone Number | rcptpeHpno: 샘플코드에서 확인된 필드 | rcptpeHpno: 수취인 휴대폰번호 Recipient Mobile Phone Number
수령자명,rcptpeNm,업체 주문/배송,1,단일,✅ 핵심 UDS,rcptpeNm: 수취인 Recipient | rcptpeNm: 수취인 Recipient | rcptpeNm: 샘플코드에서 확인된 필드
수취인 구우편번호(6자리) Recipient Old P,shpplocOldZipcd,업체 주문/배송,1,단일,✅ 핵심 UDS,shpplocOldZipcd: 수취인 구우편번호(6자리) Recipient Old Postal Code (6digits) | shpplocOldZipcd: 수취인 구우편번호(6자리) Recipient Old Postal Code (6digits)
수취인 도로명주소 Recipient Road Name Address,shpplocRoadAddr,업체 주문/배송,1,단일,✅ 핵심 UDS,shpplocRoadAddr: 수취인 도로명주소 Recipient Road Name Address
실주문금액,rlordAmt,업체 주문/배송,1,단일,✅ 핵심 UDS,rlordAmt: 결제가 * 해당 항목은 배송을 위한 참고 정보입니다. 정산을 위해서는 정산 API를 활용해주세요. Real Order Amount * This is reference information for Shipping. Please use Settlement API for an accurate settlement. | rlordAmt: 샘플코드에서 확인된 필드
영업점번호 Distribution of Sales Nu,salestrNo,업체 주문/배송,1,단일,✅ 핵심 UDS,salestrNo: 영업점번호 Distribution of Sales Number
예약판매여부 Sales By Subscription O,rsvtItemYn,업체 주문/배송,1,단일,✅ 핵심 UDS,rsvtItemYn: 예약판매여부 Sales By Subscription Order Yes Or No Y: Sales By Subscription / N: Not Sales By Subscription
예약판매여부 Y/N Sales By Subscripti,rsvtItemYn,업체 주문/배송,1,단일,✅ 핵심 UDS,rsvtItemYn: 예약판매여부 Y/N Sales By Subscription Yes Or No Y/N
