운송장등록오류코드 10 중량정보오류 20 운송장번호오류,wblRegErrCd,업체 주문/배송,1,단일,✅ 핵심 UDS,wblRegErrCd: 운송장등록오류코드 10 중량정보오류 20 운송장번호오류 30 수량변경주문번호 40 전체취소주문번호 50 정상 Waybill Registeration Error Code 10 Weight Information Error 20 Waybill Number Error 30 Quantity Change Order Number 40 Cancel-All Order Number 50 Normal | wblRegErrCd: 운송장등록오류코드 10 중량정보오류 20 운송장번호오류 30 수량변경주문번호 40 전체취소주문번호 50 정상 Waybill Registeration Error Code 10 Weight Information Error 20 Waybill Number Error 30 Quantity Change Order Number 40 Cancel-All Order Number 50 Normal
운송장등록오류코드명 Waybill Registeration Error C,wblRegErrCdNm,업체 주문/배송,1,단일,✅ 핵심 UDS,wblRegErrCdNm: 운송장등록오류코드명 Waybill Registeration Error Code Name
운송장번호,wblNo,업체 주문/배송,1,단일,✅ 핵심 UDS,"wblNo: 운송장번호 Waybill Number | wblNo: 운송장번호 * shppTypeCd:20, 40 또는 shppTypeDtlCd:91 일때만 필수 Waybill Number * Key Value for getting notice detail | wblNo: 샘플코드에서 확인된 필드"
운송장번호등록여부 Y/N Waybill Number R,wblNoRegYn,업체 주문/배송,1,단일,✅ 핵심 UDS,wblNoRegYn: 운송장번호등록여부 Y/N Waybill Number Registered Yes Or No Y/N
운송장변경이력 Waybill Change History,wblChngYn,업체 주문/배송,1,단일,✅ 핵심 UDS,wblChngYn: 운송장변경이력 Waybill Change History
원주문번호,orordNo,업체 주문/배송,1,단일,✅ 핵심 UDS,orordNo: 원주문번호 Original Order Number | orordNo: 샘플코드에서 확인된 필드 | orordNo: 원주문번호 Original Order Number
원주문번호 (2022.1.5 삭제. 'orordNo'를,orOrdNo,업체 주문/배송,1,단일,✅ 핵심 UDS,orOrdNo: 원주문번호 (2022.1.5 삭제. 'orordNo'를 사용해주세요) Original Order Number (2022.1.5 deleted. Please use 'orordNo')
원주문상품 순번,orordItemSeq,업체 주문/배송,1,단일,✅ 핵심 UDS,orordItemSeq: 원주문상품순번 Original Order Item Sequence | orordItemSeq: 샘플코드에서 확인된 필드 | orordItemSeq: 원주문상품순번 Original Order Item Sequence
응답 형식,Accept,업체 주문/배송,1,단일,✅ 핵심 UDS,Accept: application/xml application/json application/xml application/json | Accept: application/xml application/json application/xml application/json | Accept: application/xml application/json application/xml application/json
이벤트순번 Event Sequence,evntSeq,업체 주문/배송,1,단일,✅ 핵심 UDS,evntSeq: 이벤트순번 Event Sequence
이전시스템주문순번 Previous System Orde,bfOrderSeq,업체 주문/배송,1,단일,✅ 핵심 UDS,bfOrderSeq: 이전시스템주문순번 Previous System Order Sequence | bfOrderSeq: 이전시스템주문순번 Previous System Order Sequence | bfOrderSeq: 이전시스템주문순번 Previous System Order Sequence
이전주문번호 Previous System Order N,bfOrderId,업체 주문/배송,1,단일,✅ 핵심 UDS,bfOrderId: 이전주문번호 Previous System Order Number | bfOrderId: 이전주문번호 Previous System Order Number | bfOrderId: 이전주문번호 Previous System Order Number
인터파크도서 : 도서쿠폰번호 Interpark Book,bookCpnNo,업체 주문/배송,1,단일,✅ 핵심 UDS,bookCpnNo: 인터파크도서 : 도서쿠폰번호 Interpark Books : Book Coupon Number
인터파크도서 : 도서쿠폰할인금액 Interpark Books : Book,bookCpnDcAmt,업체 주문/배송,1,단일,✅ 핵심 UDS,bookCpnDcAmt: 인터파크도서 : 도서쿠폰할인금액 Interpark Books : Book Coupon Discount Fee
자동결품예정여부 Scheduled to automati,autoShortgYn,업체 주문/배송,1,단일,✅ 핵심 UDS,autoShortgYn: 자동결품예정여부 Scheduled to automatically sell out | autoShortgYn: 자동결품예정여부 Scheduled to automatically sell out
재지시여부 구분 Y/N Reinstruct Yes Or No Reinst,reOrderYns,업체 주문/배송,1,단일,✅ 핵심 UDS,reOrderYns: 재지시여부 구분 Y/N Reinstruct Yes Or No Reinstruct : Y Not Reinstruct : N | reOrderYns: 재지시여부 구분 Y/N Reinstruct Yes Or No Reinstruct : Y Not Reinstruct : N | reOrderYns: 재지시여부 구분 Y/N Reinstruct Yes Or No Reinstruct : Y Not Reinstruct : N
재지시여부구분 Reinstruct Yes Or No,reOrderYn,업체 주문/배송,1,단일,✅ 핵심 UDS,reOrderYn: 재지시여부구분 Reinstruct Yes Or No | reOrderYn: 재지시여부구분 Reinstruct Yes Or No | reOrderYn: 재지시여부구분 Reinstruct Yes Or No
정산반영일시 Fee Adjustment Reflecte,settlRfltDts,업체 주문/배송,1,단일,✅ 핵심 UDS,settlRfltDts: 정산반영일시 Fee Adjustment Reflected Date
제휴유형명 Alliance Type Name,allnTypeNm,업체 주문/배송,1,단일,✅ 핵심 UDS,allnTypeNm: 제휴유형명 Alliance Type Name
제휴주문번호 Alliance Order Number,allnOrdNo,업체 주문/배송,1,단일,✅ 핵심 UDS,allnOrdNo: 제휴주문번호 Alliance Order Number | allnOrdNo: 제휴주문번호 Alliance Order Number | allnOrdNo: 제휴주문번호 Alliance Order Number
조회 시작일,perdStrDts,업체 주문/배송,1,단일,✅ 핵심 UDS,"perdStrDts: 기간시작일, 일반조회일 경우 필수 값. 기간은 180일 이내 If general search, then mandatory value. Period is within 180 days | perdStrDts: 샘플코드에서 확인된 필드 | perdStrDts: 샘플코드에서 확인된 필드"
조회 종료일,perdEndDts,업체 주문/배송,1,단일,✅ 핵심 UDS,"perdEndDts: 기간종료일, 일반조회일 경우 필수 값. 기간은 180일 이내 If general search, then mandatory value. Period is within 180 days | perdEndDts: 샘플코드에서 확인된 필드 | perdEndDts: 샘플코드에서 확인된 필드"
조회기간 유형,perdType,업체 주문/배송,1,단일,✅ 핵심 UDS,"perdType: 기간타입, 일반조회일 경우 필수 값 01 배송지시일 02 주문완료일 03 출고예정일 If general search, then mandatory value. 01 Shipping Instructed Date 02 Order Completed Date 03 Release Scheduled Date | perdType: 샘플코드에서 확인된 필드 | perdType: 샘플코드에서 확인된 필드"
주문 배송메모,ordMemoCntt,업체 주문/배송,1,단일,✅ 핵심 UDS,ordMemoCntt: 고객배송메모 Customer Shipping Memo | ordMemoCntt: 샘플코드에서 확인된 필드 | ordMemoCntt: 고객배송메모 Customer Shipping Memo
주문배송지ID Order Shipping Address,ordShpplocId,업체 주문/배송,1,단일,✅ 핵심 UDS,ordShpplocId: 주문배송지ID Order Shipping Address Identification
주문번호,ordNo,업체 주문/배송,1,단일,✅ 핵심 UDS,ordNo: 주문번호 Order Number | ordNo: 샘플코드에서 확인된 필드 | ordNo: 주문번호 Order Number
주문비용발생코드 01: 부과 02: 부과취소 Shipp,ordCstOccCd,업체 주문/배송,1,단일,✅ 핵심 UDS,ordCstOccCd: 주문비용발생코드 01: 부과 02: 부과취소 Shipping Cost Cash On Delivery Yes Or No 01:Charge 02:Waive
주문비용아이디 Order Cost Identificat,ordCstId,업체 주문/배송,1,단일,✅ 핵심 UDS,ordCstId: 주문비용아이디 Order Cost Identification
주문상태 코드,ordStatCd,업체 주문/배송,1,단일,✅ 핵심 UDS,ordStatCd: 주문상태코드 Order Status Code | ordStatCd: 샘플코드에서 확인된 필드
주문상품 순번,ordItemSeq,업체 주문/배송,1,단일,✅ 핵심 UDS,ordItemSeq: 주문순번 Order Sequence | ordItemSeq: 샘플코드에서 확인된 필드 | ordItemSeq: 주문순번 Order Sequence
주문상품구분 Order Item Division,ordItemDivNm,업체 주문/배송,1,단일,✅ 핵심 UDS,ordItemDivNm: 주문상품구분 Order Item Division | ordItemDivNm: 주문상품구분 Order Item Division
주문상품유형명 Order Item Type Name,ordItemTypeNm,업체 주문/배송,1,단일,✅ 핵심 UDS,ordItemTypeNm: 주문상품유형명 Order Item Type Name
주문상품유형코드 09: 옵션상품 10: 일반상품 11:,ordItemTypeCd,업체 주문/배송,1,단일,✅ 핵심 UDS,ordItemTypeCd: 주문상품유형코드 09: 옵션상품 10: 일반상품 11: 사은품 12: 추가구성상품 21: 묶음할인상품 50: 지역상품 60: 묶음상품 61: 한우묶음상품 70: 기획팩상품 Order Item Type Code 09: 옵션상품 10: 일반상품 11: 사은품 12: 추가구성상품 21: 묶음할인상품 50: 지역상품 60: 묶음상품 61: 한우묶음상품 70: 기획팩상품
주문수량,ordQty,업체 주문/배송,1,단일,✅ 핵심 UDS,ordQty: 주문수량 Order Quantity | ordQty: 샘플코드에서 확인된 필드 | ordQty: 주문수량 Order Quantity
주문완료일시 Order Completed Date,ordCmplDts,업체 주문/배송,1,단일,✅ 핵심 UDS,ordCmplDts: 주문완료일시 Order Completed Date | ordCmplDts: 주문완료일시 Order Completed Date | ordCmplDts: 주문완료일시 Order Completed Date
주문자 도로명 주소,ordpeRoadAddr,업체 주문/배송,1,단일,✅ 핵심 UDS,ordpeRoadAddr: 수취인 도로명주소 Recipient Road Name Address | ordpeRoadAddr: 샘플코드에서 확인된 필드
주문자 휴대전화,ordpeHpno,업체 주문/배송,1,단일,✅ 핵심 UDS,ordpeHpno: 주문자 휴대폰번호 Customer Mobile Phone Number | ordpeHpno: 샘플코드에서 확인된 필드 | ordpeHpno: 주문자 휴대폰번호 Customer Mobile Phone Number
주문자명,ordpeNm,업체 주문/배송,1,단일,✅ 핵심 UDS,ordpeNm: 주문자 Customer | ordpeNm: 주문자 Customer | ordpeNm: 샘플코드에서 확인된 필드
주문접수일시,ordRcpDts,업체 주문/배송,1,단일,✅ 핵심 UDS,ordRcpDts: 주문접수일시 Order Registered Date | ordRcpDts: 샘플코드에서 확인된 필드
주문확인일 Order Confirmed Date,ordCnfDts,업체 주문/배송,1,단일,✅ 핵심 UDS,ordCnfDts: 주문확인일 Order Confirmed Date
중량정보등록여부 Y/N Weight Informatio,weightInfoRegYn / wgtRegYn,업체 주문/배송,1,단일,✅ 핵심 UDS,weightInfoRegYn: 중량정보등록여부 Y/N Weight Information Registeration Yes Or No Y/N | wgtRegYn: 중량정보등록여부 Y/N Weight Information Registeration Yes Or No Y/N
지시수량 (21.01.05 삭제. dircItemQty 를 사용해주세요.,dircQty,업체 주문/배송,1,단일,✅ 핵심 UDS,dircQty: 지시수량 (21.01.05 삭제. dircItemQty 를 사용해주세요.) Instructed Quantity (21.01.05 deleted. Please use 'dircItemQty')
지시수량 Instructed Quantity,dircItemQty,업체 주문/배송,1,단일,✅ 핵심 UDS,dircItemQty: 지시수량 Instructed Quantity | dircItemQty: 지시수량 Instructed Quantity | dircItemQty: 지시수량 Instructed Quantity
지연횟수 Delay Counts,delayNts,업체 주문/배송,1,단일,✅ 핵심 UDS,delayNts: 지연횟수 Delay Counts
착불 여부,shppcstCodYn,업체 주문/배송,1,단일,✅ 핵심 UDS,"shppcstCodYn: 배송비 착불여부 Y: 착불 N: 선불 Shipping Cost Cash On Delivery Yes Or No Y: Cash On Delivery N: Prepaid"" | shppcstCodYn: 샘플코드에서 확인된 필드 | shppcstCodYn: 배송비 착불여부 Y: 착불 N: 선불 Shipping Cost Cash On Delivery Yes Or No Y: Cash On Delivery N: Prepaid"""
처리수량 Processed Quantity,procItemQty,업체 주문/배송,1,단일,✅ 핵심 UDS,procItemQty: 처리수량 Processed Quantity | procItemQty: 처리수량 Processed Quantity | procItemQty: 처리수량 Processed Quantity
최종배송상세진행상태명 Final Shipping Detail Proces,lastShppProgStatDtlNm,업체 주문/배송,1,단일,✅ 핵심 UDS,lastShppProgStatDtlNm: 최종배송상세진행상태명 Final Shipping Detail Process Status Name
최종배송상세진행상태명(배송상품단위) Final Shipping Detai,lastShppProgStatDtlNm,업체 주문/배송,1,단일,✅ 핵심 UDS,lastShppProgStatDtlNm: 최종배송상세진행상태명(배송상품단위) Final Shipping Detail Process Status Name (Shipping Item Unit)
최종배송상세진행상태코드 11 배송지시 21 피킹지시 2,lastShppProgStatDtlCd,업체 주문/배송,1,단일,✅ 핵심 UDS,lastShppProgStatDtlCd: 최종배송상세진행상태코드 11 배송지시 21 피킹지시 22 피킹완료 31 패킹완료 41 출고보류 42 출고지연 43 출고완료 51 배송완료 52 배송거절 Final Shipping Detail Process Status Code 11 Shipping Instructed 21 Picking Instructed 22 Picking Completed 31 Packing Completed 41 Release On Hold 42 Release Delayed 43 Release Completed 51 Shipping Completed 52 Shipping Rejected | lastShppProgStatDtlCd: 최종배송상세진행상태코드 11 배송지시 21 피킹지시 22 피킹완료 31 패킹완료 41 출고보류 42 출고지연 43 출고완료 51 배송완료 52 배송거절 Final Shipping Detail Process Status Code 11 Shipping Instructed 21 Picking Instructed 22 Picking Completed 31 Packing Completed 41 Release On Hold 42 Release Delayed 43 Release Completed 51 Shipping Completed 52 Shipping Rejected
최종배송상세진행상태코드(배송단위) 11 배송지시 21 ,shppTabProgStatCd,업체 주문/배송,1,단일,✅ 핵심 UDS,shppTabProgStatCd: 최종배송상세진행상태코드(배송단위) 11 배송지시 21 피킹지시 22 피킹완료 31 패킹완료 41 출고보류 42 출고지연 43 출고완료 51 배송완료 52 배송거절 Final Shipping Detail Process Status Code (Shipping Unit) 11 Shipping Instructed 21 Picking Instructed 22 Picking Completed 31 Packing Completed 41 Release On Hold 42 Release Delayed 43 Release Completed 51 Shipping Completed 52 Shipping Rejected
최종배송상세진행상태코드(배송상품단위) 11 배송지시 2,lastShppProgStatDtlCd,업체 주문/배송,1,단일,✅ 핵심 UDS,lastShppProgStatDtlCd: 최종배송상세진행상태코드(배송상품단위) 11 배송지시 21 피킹지시 22 피킹완료 31 패킹완료 41 출고보류 42 출고지연 43 출고완료 51 배송완료 52 배송거절 Final Shipping Detail Process Status Code (Shipping Item Unit) 11 Shipping Instructed 21 Picking Instructed 22 Picking Completed 31 Packing Completed 41 Release On Hold 42 Release Delayed 43 Release Completed 51 Shipping Completed 52 Shipping Rejected
출고기준일 Deadline of Retrieval (D,whoutCritnDt,업체 주문/배송,1,단일,✅ 핵심 UDS,whoutCritnDt: 출고기준일 Deadline of Retrieval (Date) | whoutCritnDt: 출고기준일 Deadline of Retrieval (Date) | whoutCritnDt: 출고기준일 Deadline of Retrieval (Date)
출고수량 Release Quantity,whoutItemQty,업체 주문/배송,1,단일,✅ 핵심 UDS,whoutItemQty: 출고수량 Release Quantity
출고완료일시 Release Completed Date,whoutCmplDts / whoutDt,업체 주문/배송,1,단일,✅ 핵심 UDS,whoutCmplDts: 출고완료일시 Release Completed Date | whoutDt: 출고완료일시 Release Completed Date
출고유형 상세코드,shppDivDtlCd,업체 주문/배송,1,단일,✅ 핵심 UDS,shppDivDtlCd: 배송구분상세코드 11 일반출고 12 부분출고 14 재배송 15 교환출고 16 AS출고 Release Type 11 General Release 12 Partial Release 14 Re-shipping 15 Exchange Release 16 AS Release | shppDivDtlCd: 배송구분상세코드 11 일반출고 12 부분출고 14 재배송 15 교환출고 16 AS출고 Release Type 11 General Release 12 Partial Release 14 Re-shipping 15 Exchange Release 16 AS Release | shppDivDtlCd: 샘플코드에서 확인된 필드
출고일구분코드 10: 오늘출발 Forwarding da,whddDivCd,업체 주문/배송,1,단일,✅ 핵심 UDS,whddDivCd: 출고일구분코드 10: 오늘출발 Forwarding date classification code 10: one-day shipping | whddDivCd: 출고일구분코드 10: 오늘출발 Forwarding date classification code 10: one-day shipping
출고지연사유코드 01 공급지연/출고지연 02 고객협의후,shortgRsnCd,업체 주문/배송,1,단일,✅ 핵심 UDS,shortgRsnCd: 출고지연사유코드 01 공급지연/출고지연 02 고객협의후배송(배송비결제) 03 제작상품 05 해외배송비 재결제 대기 21 당일출고/상품분리 Shpping Delay Reason Code 01 Supply Delay / Warehouse Out Delay 02 Shpping After Customer Consultation(Shpping Payment) 03 Custom Made Goods 05 Waiting For Repayment Of Overseas Shpping Fee 21 Shpping On The Day / Product Separation
취소수량 Canceled Quantity,cnclItemQty,업체 주문/배송,1,단일,✅ 핵심 UDS,cnclItemQty: 취소수량 Canceled Quantity | cnclItemQty: 취소수량 Canceled Quantity
취소요청상태코드 10:취소요청 50:취소철회 60:취소,ordProcDemndStatCd,업체 주문/배송,1,단일,✅ 핵심 UDS,ordProcDemndStatCd: 취소요청상태코드 10:취소요청 50:취소철회 60:취소승인 70:취소거부 Status of cancel request
택배사 업체 ID,delicoVenId,업체 주문/배송,1,단일,✅ 핵심 UDS,"delicoVenId: 택배사ID Shipping Company | delicoVenId: 샘플코드에서 확인된 필드 | delicoVenId: 택배사 * shppTypeCd:20, 40 또는 shppTypeDtlCd:91 일때만 필수 Shipping Company * Key Value for getting notice detail"
택배사명 Shipping Company Name,delicoVenNm,업체 주문/배송,1,단일,✅ 핵심 UDS,delicoVenNm: 택배사명 Shipping Company Name | delicoVenNm: 택배사명 Shipping Company Name
특정영업점번호 Specific Sales Branch ,speSalestrNo,업체 주문/배송,1,단일,✅ 핵심 UDS,speSalestrNo: 특정영업점번호 Specific Sales Branch Number
판매가,sellprc,업체 주문/배송,1,단일,✅ 핵심 UDS,sellprc: 판매가 Sales Price | sellprc: 샘플코드에서 확인된 필드 | sellprc: 판매가 Sales Price
판매불가사유내용 Sales Not Permitted Reason Cont,shortgProcDtlc,업체 주문/배송,1,단일,✅ 핵심 UDS,shortgProcDtlc: 판매불가사유내용 Sales Not Permitted Reason Content
판매불가신청상태 11 결품등록 12 결품CS처리중 13,shortgProgStatCd,업체 주문/배송,1,단일,✅ 핵심 UDS,shortgProgStatCd: 판매불가신청상태 11 결품등록 12 결품CS처리중 13 결품확정 21 상품정보오류등록 22 상품정보오류CS처리중 23 상품정보오류확정 41 입고지연등록 43 입고지연완료 51 배송지연등록 Sales Not Permitted Status 11 Shortage Of Stock Registered 12 Shortage Of Stock CS Processing 13 Shortage Of Stock Confirmed 21 Item Information Error Registered 22 Item Information Error CS Processing 23 Item Information Error Confirmed 41 Stock Delay Registered 43 Stock Delay Completed 51 Shipping Delay Registered | shortgProgStatCd: 판매불가신청상태 11 결품등록 12 결품CS처리중 13 결품확정 21 상품정보오류등록 22 상품정보오류CS처리중 23 상품정보오류확정 41 입고지연등록 43 입고지연완료 51 배송지연등록 Sales Not Permitted Status 11 Shortage Of Stock Registered 12 Shortage Of Stock CS Processing 13 Shortage Of Stock Confirmed 21 Item Information Error Registered 22 Item Information Error CS Processing 23 Item Information Error Confirmed 41 Stock Delay Registered 43 Stock Delay Completed 51 Shipping Delay Registered
하위공급업체명 Low Rank Supply Vendor Name,shppLrnkVenNm,업체 주문/배송,1,단일,✅ 핵심 UDS,shppLrnkVenNm: 하위공급업체명 Low Rank Supply Vendor Name | shppLrnkVenNm: 하위공급업체명 Low Rank Supply Vendor Name
하위공급업체아이디 Low Rank Supply Vend,shppLrnkVenId,업체 주문/배송,1,단일,✅ 핵심 UDS,shppLrnkVenId: 하위공급업체아이디 Low Rank Supply Vendor Identification | shppLrnkVenId: 하위공급업체아이디 Low Rank Supply Vendor Identification
할인금액,dcAmt,업체 주문/배송,1,단일,✅ 핵심 UDS,dcAmt: 할인가 * 해당 항목은 배송을 위한 참고 정보입니다. 정산을 위해서는 정산 API를 활용해주세요. Discount Amount * This is reference information for Shipping. Please use Settlement API for an accurate settlement. | dcAmt: 샘플코드에서 확인된 필드
해외배송비처리구분 International Shipping Cost Pr,frgShppcstProcDivCdNm,업체 주문/배송,1,단일,✅ 핵심 UDS,frgShppcstProcDivCdNm: 해외배송비처리구분 International Shipping Cost Process Division
해외배송비처리구분코드 00 중량정보미등록 10 적합 2,frgShppcstProcDivCd,업체 주문/배송,1,단일,✅ 핵심 UDS,frgShppcstProcDivCd: 해외배송비처리구분코드 00 중량정보미등록 10 적합 20 결제요청 30 환불요청 40 결제 CS 처리중 50 환불 CS 처리중 60 결제완료 70 환불완료 80 해외결제수단처리 Shipping Type Code 00 Weight Information Not Registered 10 Appropriate 20 Payment Request 30 Refund Request 40 Payment CS Processing 50 Refund CS Processing 60 Payment Completed 70 Refund Completed 80 International Payment Method
해외배송지국가코드 Overseas Counrty cod,frgShpplocCntryCd,업체 주문/배송,1,단일,✅ 핵심 UDS,frgShpplocCntryCd: 해외배송지국가코드 Overseas Counrty code
해외배송지기본주소 Overseas Recipient Basic Addre,frgShpplocBascAddr,업체 주문/배송,1,단일,✅ 핵심 UDS,frgShpplocBascAddr: 해외배송지기본주소 Overseas Recipient Basic Address
해외배송지상세주소 Overseas Recipient Detail Addr,frgShpplocDtlAddr,업체 주문/배송,1,단일,✅ 핵심 UDS,frgShpplocDtlAddr: 해외배송지상세주소 Overseas Recipient Detail Address
해외배송지우편번호 Overseas Recipient P,frgShpplocZipcd,업체 주문/배송,1,단일,✅ 핵심 UDS,frgShpplocZipcd: 해외배송지우편번호 Overseas Recipient Postal Code
해외배송지전화번호 Overseas Recipient P,frgShpplocTelno,업체 주문/배송,1,단일,✅ 핵심 UDS,frgShpplocTelno: 해외배송지전화번호 Overseas Recipient Phone Number
해외배송지휴대전화번호 Overseas Recipient,frgShpplocHpno,업체 주문/배송,1,단일,✅ 핵심 UDS,frgShpplocHpno: 해외배송지휴대전화번호 Overseas Recipient Mobile Phone Number
협력사 단품 ID,uSplVenItemId,업체 주문/배송,1,단일,✅ 핵심 UDS,uSplVenItemId: 협력업체단품ID Vendor Unit Item Number | uSplVenItemId: 샘플코드에서 확인된 필드 | uSplVenItemId: 협력업체단품ID Vendor Unit Item Number
협력사 상품 ID,splVenItemId,업체 주문/배송,1,단일,✅ 핵심 UDS,splVenItemId: 협력업체상품ID Vendor Item Number | splVenItemId: 협력업체상품ID Vendor Item Number | splVenItemId: 샘플코드에서 확인된 필드
회원 ID,mbrId,업체 주문/배송,1,단일,✅ 핵심 UDS,mbrId: 주문자ID Customer ID | mbrId: 주문자ID Customer ID | mbrId: 주문자ID Customer ID
회원 로그인 ID,mbrLoginId,업체 주문/배송,1,단일,✅ 핵심 UDS,mbrLoginId: 주문 회원 ID order member id | mbrLoginId: 샘플코드에서 확인된 필드
